<?xml version="1.0" encoding="UTF-8"?>
<!-- 
  Article XML
  This file represents a structured educational article.
  It includes metadata (title, author, abstract), sections with paragraphs,
  and a list of references.
-->
<article xmlns:xsi="http://www.w3.org/2001/XMLSchema-instance" xsi:noNamespaceSchemaLocation="../schemas/article_schema.xsd">
  <title>Understanding the Water Cycle</title>
  <author>Dr. Emily Rivers</author>
  <abstract>A brief overview of the continuous movement of water on, above, and below the surface of the Earth.</abstract>

  <sections>
    <section>
      <title>Introduction</title>
      <paragraph>The water cycle, also known as the hydrologic cycle, describes the continuous movement of water within the Earth and atmosphere. It is a complex system that includes many different processes. Liquid water evaporates into water vapor, condenses to form clouds, and precipitates back to earth in the form of rain and snow.</paragraph>
    </section>
    <section>
      <title>Evaporation and Transpiration</title>
      <paragraph>Evaporation is the process by which water changes from a liquid to a gas or vapor. The primary source of energy for evaporation is the sun. Transpiration is the release of water vapor from plants and soil into the air.</paragraph>
    </section>
    <section>
      <title>Condensation and Precipitation</title>
      <paragraph>Condensation is the process by which water vapor in the air is changed into liquid water. It is responsible for the formation of clouds. Precipitation is water released from clouds in the form of rain, freezing rain, sleet, snow, or hail.</paragraph>
    </section>
    <section>
      <title>Conclusion</title>
      <paragraph>The water cycle is vital for the continued existence of life on Earth. It ensures the availability of water for all living organisms and helps regulate the climate.</paragraph>
    </section>
  </sections>

  <references>
    <reference>Book: "Earth's Environment"</reference>
    <reference>Research Paper: "Global Hydrological Cycles"</reference>
  </references>
</article>
